"Address","Occurrences","Title 1","Title 1 Length","Title 1 Pixel Width","Indexability","Indexability Status"
"https://www.txsparks.com/","1","Commercial & Residential General Contractor Services | TX Sparks","64","583","Indexable",""
"https://www.txsparks.com/projects/lexington/","1","Lexington Square | Premier Commercial Construction in Frisco, TX","64","581","Indexable",""
"https://www.txsparks.com/services/construction-management/","1","Residential & Commercial Construction Management Services Texas | TX Sparks","75","712","Indexable",""
"https://www.txsparks.com/blogs/avoid-mechanics-liens-construction-projects/","1","How to Avoid Mechanic's Liens in Construction Projects","54","492","Indexable",""
"https://www.txsparks.com/blogs/managing-construction-projects-using-it-software/","1","Using IT Software for Efficient Construction Management","55","507","Indexable",""
"https://www.txsparks.com/blogs/how-to-keep-your-construction-project-on-budget/","1","Effective Tips to Keep Your Construction Project on Budget","58","519","Indexable",""
"https://www.txsparks.com/blogs/perfect-destination-for-homeowners/","1","Your Perfect Destination: Homeownership with Texas Sparks","57","538","Indexable",""
"https://www.txsparks.com/blogs/design-planning-for-commercial-residential-projects/","1","Design & Planning: Mastery for Commercial & Residential Builds","62","565","Indexable",""
"https://www.txsparks.com/industries/commercial-construction/","1","Texas Commercial Construction Services & Project Management | TX Sparks","71","677","Indexable",""
"https://www.txsparks.com/services/","1","Construction Services (Texas) | TX Sparks","41","371","Indexable",""
"https://www.txsparks.com/services/design-and-permitting/","1","Residential & Commercial Design and Permitting Services | TX Sparks","67","613","Indexable",""
"https://www.txsparks.com/services/land-feasibility/","1","Land feasibility study for land development in Texas - TX Sparks","64","566","Indexable",""
"https://www.txsparks.com/blogs/choose-right-general-contractor-for-commercial-project/","1","6 Steps to Select the Right General Contractor for Your Commercial Project","74","657","Indexable",""
"https://www.txsparks.com/blogs/what-is-land-entitlement-and-why-it-matters/","1","What Is Land Entitlement and Why It Matters for Projects","56","501","Indexable",""
"https://www.txsparks.com/blogs/steps-to-start-commercial-build-dfw/","1","Starting a Commercial Build in DFW: 8 Things You Should Know","60","562","Indexable",""
"https://www.txsparks.com/blogs/best-materials-for-construction-project/","1","Choosing the Best Materials for Construction Projects","53","475","Indexable",""
"https://www.txsparks.com/blogs/the-impact-of-technology-on-construction-trends-and-innovations/","1","Construction Technology Trends | Texas Sparks Constructions","59","551","Indexable",""
"https://www.txsparks.com/blogs/understanding-building-codes-regulations/","1","Decoding Building Codes & Regulations - Texas Sparks Constructions","66","612","Indexable",""
"https://www.txsparks.com/blogs/financial-proforma-real-estate/","1","Importance of Financial Proforma in Real Estate Development","59","545","Indexable",""
"https://www.txsparks.com/blogs/buying-engineered-land-due-diligence-checklist/","1","Buying Engineered Land? 10 Due Diligence Steps | TX Sparks Construction","71","654","Indexable",""
"https://www.txsparks.com/blogs/advantages-preconstruction-services-successful-ground-up-construction-project/","1","Preconstruction Services for Ground-Up Success - Texas Sparks Constructions","75","693","Indexable",""
"https://www.txsparks.com/services/mud-pid-services/","1","MUD & PID Services | TX Sparks - Specialized Solutions","54","486","Indexable",""
"https://www.txsparks.com/blogs/common-construction-mistakes-avoid-successful-projects/","1","ommon Construction Mistakes to Avoid for Project Success","56","527","Indexable",""
"https://www.txsparks.com/blogs/optimizing-civil-engineering-save-3m-earthwork-costs/","1","Optimizing Civil Engineering to Save $3M in Earthwork Costs","59","532","Indexable",""
"https://www.txsparks.com/blogs/tips-for-finding-the-right-contractor-for-your-texas-construction-project/","1","Find the Right Texas Contractor | Tips & Guidance","49","438","Indexable",""
"https://www.txsparks.com/blogs/top-trends-commercial-design/","1","Commercial Design Trends - TX Sparks Insights","45","422","Indexable",""
"https://www.txsparks.com/blogs/","1","TX Sparks Blog | Construction Insights and Updates","50","457","Indexable",""
"https://www.txsparks.com/blogs/navigating-the-permitting-process-tips-for-streamlining-your-construction-project/","1","Simplify Construction Permits - Texas Sparks Constructions Guide","64","584","Indexable",""
"https://www.txsparks.com/blogs/the-dos-and-donts-of-hiring-a-general-contractor/","1","Expert Tips for Hiring a General Contractor - Texas Sparks Constructions","72","637","Indexable",""
"https://www.txsparks.com/blogs/streamlining-design-build-process/","1","Streamlining the Design-Build Process | Texas Sparks Construction","65","590","Indexable",""
"https://www.txsparks.com/blogs/lien-waivers-real-estate-developers-owners/","1","Lien Waivers Are Crucial for Real Estate Developers & Owners","60","538","Indexable",""
"https://www.txsparks.com/blogs/right-contractor-for-your-home-remodel-project/","1","Selecting the Right Contractor for Your Home Remodel","52","479","Indexable",""
"https://www.txsparks.com/projects/shoppes-at-bellblvd/","1","The Shoppes at Bell Blvd | Premier Commercial Center in Cedar Park","66","600","Indexable",""
"https://www.txsparks.com/blogs/make-commercial-construction-project-bankable/","1","9 Ways to Make a Commercial Construction Project Bankable","57","543","Indexable",""
"https://www.txsparks.com/blogs/design-services-can-benefit-ground-up-construction-projects/","1","Maximize Success: Design Services for Ground-Up Projects","56","522","Indexable",""
"https://www.txsparks.com/industries/residential-construction/","1","Residential Construction Services in Texas | TX Sparks","54","480","Indexable",""
"https://www.txsparks.com/contact-us/","1","Contact TX Sparks | Construction Management Experts in Texas","60","566","Indexable",""
"https://www.txsparks.com/blogs/general-contractors-ground-up-construction-projects/","1","Expert General Contractors for Ground-Up Projects - Texas Sparks Constructions","78","707","Indexable",""
"https://www.txsparks.com/blogs/how-to-choose-the-right-general-contractor-for-your-texas-project/","1","How to Choose the Right General Contractor in Texas | TX Sparks Construction","76","693","Indexable",""
"https://www.txsparks.com/careers/","1","Careers at TX Sparks | Join the Construction Experts","52","461","Indexable",""
"https://www.txsparks.com/news-events/","1","TX Sparks News & Events | Construction Industry Updates","55","511","Indexable",""
"https://www.txsparks.com/blogs/tips-choose-general-contractor/","1","Key Tips to Choose the Ideal General Contractor","47","422","Indexable",""
"https://www.txsparks.com/blogs/the-pitfalls-of-hiring-cheap-contractors-in-commercial-real-estate-development/","1","Avoid Pitfalls: Hiring Contractors for Real Estate Development","62","542","Indexable",""
"https://www.txsparks.com/blogs/construction-right-commercial-project/","1","Constructing the Perfect Commercial Project: Key Insights","57","513","Indexable",""
"https://www.txsparks.com/blogs/the-role-of-permits-and-inspections-in-construction-projects/","1","Permits & Inspections in Construction | Texas Sparks Constructions","66","597","Indexable",""
"https://www.txsparks.com/blogs/prevent-construction-delay-north-texas/","1","5 Strategies to Prevent Construction Delays in North Texas","58","516","Indexable",""
"https://www.txsparks.com/blogs/unlocking-the-potential-of-land-the-importance-of-land-entitlement-for-successful-development/","1","Land Entitlement for Successful Development - Texas Sparks Constructions","72","667","Indexable",""
"https://www.txsparks.com/blogs/interior-build-out-inspection-checklist-2/","1","Avoid Costly Delays | Essential Interior Build-Out Inspection Guide","67","576","Indexable",""
"https://www.txsparks.com/projects/shops-at-new-hope/","1","Shops at New Hope by TX Sparks","30","297","Indexable",""
"https://www.txsparks.com/blogs/commercial-land-for-business/","1","Selecting Prime Commercial Land for Your Business Growth","56","530","Indexable",""
"https://www.txsparks.com/projects/","1","Our Projects | TX Sparks Management Portfolio","45","418","Indexable",""
"https://www.txsparks.com/privacy-policy/","1","TX Sparks Privacy Policy","24","219","Indexable",""
"https://www.txsparks.com/blogs/discover-the-advantages-of-custom-home-construction-for-personalized-design/","1","Advantages of Custom Home Construction | Texas Sparks Constructions","67","643","Indexable",""
"https://www.txsparks.com/blogs/renovation-process-help-set-space-faster-efficiently/","1","Efficient Renovation: Set Up Your Space Quickly & Smartly","57","510","Indexable",""
"https://www.txsparks.com/services/interior-build-out/","1","Commercial Interior Build Out Services Texas | TX Sparks","56","503","Indexable",""
"https://www.txsparks.com/blogs/underground-detention-cost-analysis/","1","Why Underground Detention Isn’t Always the Best Way to Gain More Buildable SQFT","79","738","Indexable",""
"https://www.txsparks.com/news-events/paris-baguette-franchise-build-out-mckinney/","1","Paris Baguette Franchise Interior Build-Out Completed in McKinney, Texas","72","653","Indexable",""
"https://www.txsparks.com/blogs/comprehensive-feasibility-study-by-tx-sparks/","1","Comprehensive Feasibility Study for Land Development | TX Sparks","64","592","Indexable",""
"https://www.txsparks.com/services/land-development/","1","Commercial & Residential Land Development Services | TX Sparks","62","582","Indexable",""
"https://www.txsparks.com/terms/","1","Terms - Welcome to TX SPARKS","28","286","Indexable",""
"https://www.txsparks.com/blogs/benefits-working-with-a-design-build-contractor/","1","Top Benefits of Working with a Design-Build Contractor","54","486","Indexable",""
"https://www.txsparks.com/about-us/","1","About Us – TX Sparks | Construction Consulting & Management","59","563","Indexable",""
"https://www.txsparks.com/services/land-entitlement/","1","Texas Land Entitlement Services & Consulting Experts | TX Sparks","64","581","Indexable",""
"https://www.txsparks.com/case-study/","1","Case Study | TX Sparks Construction Updates","43","402","Indexable",""
"https://www.txsparks.com/partner-program/","1","Partner Program | Construction Partnerships in Texas – TX Sparks","64","585","Indexable",""
"https://www.txsparks.com/blogs/top-challenges-in-land-development-and-how-to-overcome-them-3/","1","Mitigating Risks in Land Development: TX Sparks' Comprehensive Feasibility Study","80","729","Indexable",""
"https://www.txsparks.com/blogs/value-engineering-design-phase/","1","Value Engineering in Design Phase: Optimize Costs & Improve Efficiency","70","637","Indexable",""
"https://www.txsparks.com/blogs/transform-land-challenges-opportunities/","1","Transform Land Challenges into Opportunities with TSC","53","492","Indexable",""
"https://www.txsparks.com/blogs/land-development-challenges-overcome/","1","Top Challenges in Land Development and How to Overcome Them","59","585","Indexable",""
"https://www.txsparks.com/blogs/lien-waivers-real-estate/","1","Navigating Conditional and Unconditional Lien Waivers","53","484","Indexable",""
"https://www.txsparks.com/category/blogs/","1","Blogs Archives - Welcome to TX SPARKS","37","360","Indexable",""
"https://www.txsparks.com/blogs/understanding-zoning-laws/","1","Add MediaAdd MediaVisualTextVisualTextThe Importance of Choosing the Right Engineers and Architects for Real Estate Development For new real estate developers, whether in residential or commercial construction, choosing the right engineers and architects is one of the most critical decisions in the development process. The success of your project depends heavily on making informed choices during the planning stages, particularly when it comes to understanding the future use of your space. 1. Clarity on Space Usage is Key Before engaging your design and build team, developers need to have a clear understanding of how the space will be used. For example, how much of the property will be allocated for restaurants, personal services, general retail, medical offices, or professional spaces? This clarity helps engineers and architects design concept plans that align with the future use of the space. Each city or county has its own ordinances regarding parking requirements, which vary based on space usage. Therefore, by defining these details early, the design team can ensure compliance with local regulations, avoiding potential delays and costly redesigns during the permitting process. 2. Setting a Realistic Budget from the Start Another crucial factor is setting a clear budget for hard construction costs. Developers should communicate their budget expectations early so that engineers and architects can design plans within those constraints. This is where involving a third-party general contracting firm as an independent consultant can be invaluable. By reviewing the plans bi-weekly, the general contractor ensures that the project remains on budget and aligns with today’s market conditions. This proactive step can save developers from surprises later on. 3. Constant Communication with the Team One of the most important strategies for any developer is to maintain constant communication with engineers, architects, and construction consultants throughout the permitting and design process. Regular updates and check-ins will ensure that designs are well value-engineered, and the project is kept on track for timely completion. Value engineering—adjusting designs for cost-efficiency without compromising quality—can lead to substantial savings. Developers can also avoid costly design changes after permits have been approved, which would otherwise slow the project down and increase expenses. 4. Ensuring the Best Bid Outcomes Once the design and permit set are completed, developers can put the project out for bid. A cost-effective and well-engineered permit set ensures that the bids received fall within the expected budget range. However, if bid prices are significantly higher than anticipated, developers should consult with engineers and architects to review the bids and identify the reasons for the increased costs. This approach allows developers to address potential issues and prevent overpricing. In Summary: For developers in the real estate industry, success lies in the details. Engaging the right engineers and architects, setting clear budget expectations, and maintaining strong communication throughout the design and permitting phases will lead to more cost-effective, well-engineered projects. By investing time upfront in these critical areas, developers can secure the best outcomes, from obtaining permits to receiving bids within the allocated budget. Choosing the right team and ensuring collaboration will not only save time and money but also provide peace of mind as you move forward with your development.","3564","31464","Indexable",""
"https://www.txsparks.com/blogs/benefits-of-hiring-local-contractors-frisco/","1","Benefits of Hiring Local Contractors in Frisco: Expert Insights & Advantages","76","665","Indexable",""
"https://www.txsparks.com/blogs/navigating-phases-successful-commercial-project/","1","Mastering Commercial Projects: A Step-by-Step Guide | TSC Blog","62","570","Indexable",""
"https://www.txsparks.com/blogs/unveiling-the-significance-of-land-feasibility-studies-key-factors-for-successful-development/","1","Land Feasibility Studies | Texas Sparks Constructions","53","473","Indexable",""
"https://www.txsparks.com/blogs/emerging-tech-construction-industry/","1","Transformative Technologies Shaping the Future of Construction","62","574","Indexable",""
"https://www.txsparks.com/category/blogs/featured-blog/","1","Featured Blog Archives - Welcome to TX SPARKS","45","433","Indexable",""
"https://www.txsparks.com/services/texas-ground-up-construction/","1","Ground-Up Construction Services in Texas | TX Sparks","52","477","Indexable",""
"https://www.txsparks.com/industries/","1","Professional Residential & Commercial Industrial Construction Services (Texas) | TX Sparks","90","808","Indexable",""
"https://www.txsparks.com/projects/village-of-melissa/","1","Village of Melissa by TX Sparks","31","279","Indexable",""
"https://www.txsparks.com/projects/the-bays/","1","The Bays Project by Texas Sparks","32","300","Indexable",""
"https://www.txsparks.com/projects/clovers-plaza/","1","Clovers Plaza by TX Sparks","26","242","Indexable",""
"https://www.txsparks.com/projects/shoreline-plaza/","1","Shoreline Plaza Project by Texas Sparks","39","354","Indexable",""
"https://www.txsparks.com/blogs/integrated-services-streamline-construction-project/","1","How Integrated Services Streamline Your Construction Project | Enhancing Efficiency & Accuracy","94","851","Indexable",""
"https://www.txsparks.com/blogs/the-significance-of-extensive-feasibility-property/","1","Feasibility Studies: Key to Smart Commercial Real Estate Deals","62","554","Indexable",""
"https://www.txsparks.com/blogs/essential-due-diligence-purchasing-land-oil-wells/","1","Essential Due Diligence for Buying Land with Oil Wells","54","473","Indexable",""
"https://www.txsparks.com/blogs/right-professional-commercial-general-contractor/","1","Benefits of a Commercial General Contractor for Your Project","60","538","Indexable",""
"https://www.txsparks.com/blogs/evaluate-land-development-potential-texas/","1","Evaluating Development Potential of Texas Land","46","428","Indexable",""
"https://www.txsparks.com/projects/?category=commercial-construction","1","Our Projects | TX Sparks Management Portfolio","45","418","Non-Indexable","Canonicalised"
"https://www.txsparks.com/blogs/transforming-any-space-into-luxurious-perfection/","1","Transforming Spaces: The Art of Luxurious Interior Finish Outs","62","551","Indexable",""
"https://www.txsparks.com/blogs/transforming-ideas-into-reality-the-texas-sparks-constructions-approach-to-design-build/","1","Texas Sparks Constructions Design-Build Approach","48","455","Indexable",""
"https://www.txsparks.com/blogs/full-service-general-contractor-near-me/","1","Key Steps to Finding a Full-Service General Contractor for Your Project","71","617","Indexable",""
"https://www.txsparks.com/blogs/construction-management-effective-strategies-for-successful-constructions/","1","Effective Construction Management | Texas Sparks Constructions","62","582","Indexable",""
"https://www.txsparks.com/blogs/the-role-of-design-build-in-real-estate-development/","1","Design & Build's Impact on Real Estate Development | TSC Insights","65","588","Indexable",""
"https://www.txsparks.com/blogs/right-materials-commercial-project/","1","Top Tips for Selecting Materials for Commercial Projects","56","501","Indexable",""
"https://www.txsparks.com/blogs/sustainable-interior-design-eco-friendly/","1","Eco-Friendly Interior Design Solutions for Your Business","56","490","Indexable",""
"https://www.txsparks.com/blogs/revitalizing-spaces-inspiring-interior-finish/","1","Interior Finishes by Texas Sparks Constructions","47","421","Indexable",""
"https://www.txsparks.com/blogs/the-importance-and-benefits-of-entitlements/","1","Benefits of Entitlements | Texas Sparks Constructions","53","476","Indexable",""
"https://www.txsparks.com/blogs/land-development-stages-texas/","1","Successful Residential Land Development: Key Steps","50","468","Indexable",""
"https://www.txsparks.com/blogs/choose-right-engineers-architects-real-estate-development/","1","Choose the Best Engineers & Architects for Real Estate Success","62","562","Indexable",""
"https://www.txsparks.com/blogs/navigating-land-development-permit-sets/","1","Navigating Land Development: TX Sparks Delivers Cost-Effective and Optimized Permit Sets","88","810","Indexable",""
"https://www.txsparks.com/blogs/choosing-the-right-general-contractor/","1","Selecting the Best General Contractor | Texas Sparks Constructions","66","594","Indexable",""
"https://www.txsparks.com/projects/48-oaks-townhomes-little-elm-tx/","1","48 Oaks Townhomes | Luxury Living in Little Elm","47","425","Indexable",""
"https://www.txsparks.com/work-with-us/site-superintendent/","1","Site Superintendent Role at TX Sparks","37","334","Non-Indexable","noindex"
"https://www.txsparks.com/work-with-us/construction-project-engineer/","1","Construction Project Engineer Role at TX Sparks","47","424","Non-Indexable","noindex"
"https://www.txsparks.com/work-with-us/mba-internship-summer-2026/","1","MBA Internship Program – Summer 2026 | TX Sparks Construction","61","590","Non-Indexable","noindex"
"https://www.txsparks.com/news-events/mud-approval-gunter-201-acre-land-development/","1","TX Sparks Secures $30M MUD Approval for North Dallas Land Development","69","668","Indexable",""
"https://www.txsparks.com/news-events/news-spectra-heights-ground-up-commercial-development-lewisville-texas/","1","Spectra Heights Commercial Development | Lewisville TX | TX Sparks Construction","79","728","Indexable",""
"https://www.txsparks.com/news-events/frisco-primary-care-med-spa-medical-office-construction/","1","TX Sparks Begins Primary Care and Med Spa Medical Office Construction in Frisco, Texas","86","792","Indexable",""
"https://www.txsparks.com/news-events/arka-montessori-ground-up-construction-leander-texas/","1","TX Sparks Construction Begins ARKA Montessori Ground-Up Construction Project in Leander, Texas","94","879","Indexable",""
"https://www.txsparks.com/news-events/page/2/","1","TX Sparks News & Events | Construction Industry Updates","55","511","Non-Indexable","Canonicalised"
"https://www.txsparks.com/news-events/djc-law-round-rock-interior-finishout-austin-texas/","1","TX Sparks Construction Completes DJC Law Round Rock Interior Finish-Out | Austin, Texas","87","799","Indexable",""
"https://www.txsparks.com/news-events/page/3/","1","TX Sparks News & Events | Construction Industry Updates","55","511","Non-Indexable","Canonicalised"
"https://www.txsparks.com/projects/page/3/","1","Our Projects | TX Sparks Management Portfolio","45","418","Non-Indexable","Canonicalised"
"https://www.txsparks.com/projects/sparks-lounge/","1","Sparks Lounge Project | Interior Construction by TX Sparks","58","516","Indexable",""
"https://www.txsparks.com/projects/shepherds-place/","1","Shepherds Place Project by TX Sparks","36","338","Indexable",""
"https://www.txsparks.com/projects/page/6/","1","Our Projects | TX Sparks Management Portfolio","45","418","Non-Indexable","Canonicalised"
"https://www.txsparks.com/projects/model-finish-out-12260/","1","Commercial Model Finish Out | TX Sparks Construction Project","60","553","Indexable",""
"https://www.txsparks.com/projects/nrvm-flex/","1","NRVM Flex Commercial Project | TX Sparks Construction","53","501","Indexable",""
"https://www.txsparks.com/projects/page/2/","1","Our Projects | TX Sparks Management Portfolio","45","418","Non-Indexable","Canonicalised"
"https://www.txsparks.com/projects/model-finish-out-12250/","1","Model Finish Out Project | Commercial Construction by TX Sparks","63","578","Indexable",""
"https://www.txsparks.com/projects/qualitas-melissa/","1","Qualitas Melissa | 8,846 SF Retail & Restaurant Development","59","534","Indexable",""
"https://www.txsparks.com/projects/harrington-melissa/","1","Harrington Melissa | 8,100 SF Retail Strip Center Construction","62","541","Indexable",""
"https://www.txsparks.com/projects/djc-law-roundock/","1","DJC Law Round Rock Office | TX Sparks Construction","50","471","Indexable",""
"https://www.txsparks.com/projects/arka-montessori/","1","Arka Montessori | 13,000 SF Educational Facility Construction Project","69","611","Indexable",""
"https://www.txsparks.com/projects/sharp-re-flex/","1","Sharp RE Flex Project | Flexible Commercial Construction","56","500","Indexable",""
